{
  "schemaVersion": "0.2",
  "profileContext": {
    "education": "Invented background for pipeline testing; no real interview subject."
  },
  "projects": [
    {
      "id": "synthetic-sensor-notebook",
      "title": "Sensor comparison notebook",
      "status": "idea",
      "summary": "A fictional personal idea proposed comparing two inexpensive sensors.",
      "rawNotes": "PRIVATE_EVIDENCE_CANARY: invented internal note for synthetic-sensor-notebook. AI attribution: An AI assistant suggested questions; no measurements were generated.",
      "period": {
        "start": "2024",
        "end": "2024",
        "label": "Invented 2024 episode"
      },
      "context": {
        "type": "Personal research",
        "organization": null,
        "roleAtTime": "Contributor",
        "careerStage": "Synthetic example",
        "collaboration": "Individual exploration"
      },
      "confidentiality": {
        "level": "private",
        "publicUseApproved": false,
        "notes": [
          "Raw wording has no publication approval. Synthetic manifest supplies separately reviewed public text."
        ]
      },
      "motivation": [
        "Understand a small, observable problem."
      ],
      "problem": [
        "A fictional personal idea proposed comparing two inexpensive sensors."
      ],
      "existingSolutionsOrAlternatives": [
        "Keep the existing manual process."
      ],
      "constraints": [
        "Small invented scope; no measured service benefit."
      ],
      "myContribution": [
        "Wrote a comparison question and listed a baseline protocol."
      ],
      "teamOrExistingContribution": [
        "No team contribution claimed."
      ],
      "approachAndDecisions": [
        "Record the baseline, inspect feedback, and preserve limits."
      ],
      "differentiators": [
        "No novelty claim."
      ],
      "outcomes": [
        "Only a written plan exists; the comparison has not been run."
      ],
      "lessons": [
        "Small feedback loops can inform the next decision."
      ],
      "tools": [
        "notes",
        "spreadsheet"
      ],
      "tags": [
        "Personal research"
      ],
      "openQuestions": [
        "Whether the idea would work beyond the described setting."
      ],
      "provisionalSignals": [
        {
          "type": "Capability",
          "label": "Experiment framing",
          "interpretation": "A bounded signal; not a general performance claim.",
          "evidence": "Wrote a comparison question and listed a baseline protocol.",
          "confidence": "low",
          "confirmedByUser": false
        }
      ]
    }
  ],
  "crossProjectObservations": [],
  "suggestedClassificationTypes": [
    "Capability",
    "Working principle"
  ],
  "exportNotes": [
    "Synthetic fixture. All names, projects, results and confirmations are invented."
  ]
}
